{
  "intent_id": "33333333-3333-3333-3333-333333333333",
  "timestamp": "2026-02-18T00:00:00Z",
  "strategy_id": "demo_strategy",
  "account_id": "acct_1",
  "instrument": { "symbol": "AAPL", "asset_class": "equity" },
  "side": "buy",
  "order_type": "market",
  "qty": 5000,
  "limit_price": null
}
